{
  "schema": "sentinel-preparation-outcome/draft-1",
  "outcome": "answered",
  "exitCode": 0,
  "verdicts": {
    "policy": {
      "allowed": false,
      "asked": false,
      "reasonCode": "sentinel.verdict.notAsked"
    },
    "capability": {
      "allowed": false,
      "asked": false,
      "reasonCode": "sentinel.verdict.notAsked"
    },
    "credential": {
      "allowed": false,
      "asked": false,
      "reasonCode": "sentinel.verdict.notAsked"
    }
  },
  "status": {
    "schema": "sentinel-preparation-status/draft-1",
    "found": true,
    "preparationId": "prep-bbbbbbbbbbbbbbbbbbbbbbbbbbbbbbbb",
    "phase": "prepared",
    "acceptedAt": "2026-10-23T12:00:00.000Z",
    "deadlineAt": "2026-10-23T12:10:00.000Z",
    "runDeadlineAt": "2026-10-23T12:10:00.000Z",
    "captured": true,
    "runId": "run-cccccccccccccccccccccccccccccccc",
    "preparedRevision": 2,
    "checksStartedByPreparation": false,
    "availability": []
  }
}
